{
  "base_intent": "in_ack_v1",
  "base_workspace": "ws_demo1",
  "candidate_workspace": "ws_demo2",
  "changes": [
    {
      "digest": "sha256:patch",
      "kind": "rust"
    }
  ],
  "failure": "crash_demo1",
  "gate_profile": "phase-b",
  "gates": [
    {
      "evidence": [
        "diff_demo1"
      ],
      "name": "intent_integrity",
      "status": "pass"
    },
    {
      "evidence": [
        "ev_replay2"
      ],
      "name": "exact_regression",
      "status": "pass"
    },
    {
      "evidence": [],
      "name": "incremental_parity",
      "status": "not_yet_enforced"
    },
    {
      "evidence": [],
      "name": "certificate_rebuild",
      "status": "not_yet_enforced"
    }
  ],
  "hypothesis": "publish reply only after storage sync",
  "receipt": null,
  "repair_id": "rt_demo1",
  "schema_version": "1.0",
  "semantic_diff": "diff_demo1",
  "status": "ready"
}
